{"schema":"gcd.heap-snapshot/1","runId":"01J00000000000000000000000","index":0,"point":"mark_complete","gcIndex":1,"statementIndex":3,"totalObjects":2,"totalEdges":1,"truncated":false,"roots":[{"name":"a","target":"0"},{"name":"b","target":"1"}],"objects":[{"id":"0","slot":0,"generation":0,"region":null,"allocSeq":1,"allocStatement":0,"marked":true,"fields":[{"name":"next","target":"1"}],"discoveredBy":{"parent":null,"field":null,"root":"a"}},{"id":"1","slot":1,"generation":0,"region":null,"allocSeq":2,"allocStatement":1,"marked":true,"fields":[],"discoveredBy":{"parent":"0","field":"next","root":null}}]}
